{
  "$schema": "https://json-schema.org/draft/2020-12/schema",
  "$id": "https://scs.invalid/schemas/input-record.schema.json",
  "title": "SCS Input Record",
  "type": "object",
  "additionalProperties": false,
  "required": [
    "input_id",
    "schema_version",
    "source_kind",
    "source_locator",
    "observed_at",
    "captured_by",
    "trust_status",
    "access_boundary",
    "classification",
    "normalized_claims",
    "intake_status",
    "disposition",
    "linked_context_ids",
    "linked_work_item_ids",
    "evidence_refs",
    "privacy_note"
  ],
  "properties": {
    "input_id": {
      "type": "string",
      "minLength": 1
    },
    "schema_version": {
      "const": "scs.input-record.v1"
    },
    "source_kind": {
      "type": "string",
      "minLength": 1
    },
    "source_locator": {
      "type": "string",
      "minLength": 1
    },
    "source_revision": {
      "type": [
        "string",
        "null"
      ]
    },
    "observed_at": {
      "type": "string",
      "format": "date"
    },
    "captured_by": {
      "type": "string",
      "minLength": 1
    },
    "trust_status": {
      "enum": [
        "unreviewed",
        "source_verified",
        "corroborated",
        "disputed",
        "rejected"
      ]
    },
    "access_boundary": {
      "type": "string",
      "minLength": 1
    },
    "classification": {
      "type": "string",
      "minLength": 1
    },
    "normalized_claims": {
      "type": "array",
      "items": {
        "type": "object",
        "additionalProperties": false,
        "required": [
          "claim_id",
          "text",
          "status",
          "source_support"
        ],
        "properties": {
          "claim_id": {
            "type": "string"
          },
          "text": {
            "type": "string",
            "minLength": 1
          },
          "status": {
            "enum": [
              "observed",
              "inferred",
              "proposed",
              "verified",
              "accepted",
              "stale",
              "disputed",
              "rejected"
            ]
          },
          "source_support": {
            "type": "string"
          }
        }
      }
    },
    "intake_status": {
      "enum": [
        "captured",
        "triaged",
        "ready",
        "in_progress",
        "needs_information",
        "blocked",
        "conflicted",
        "review",
        "accepted",
        "superseded",
        "rejected"
      ]
    },
    "disposition": {
      "type": "string",
      "minLength": 1
    },
    "linked_context_ids": {
      "type": "array",
      "items": {
        "type": "string"
      },
      "uniqueItems": true
    },
    "linked_work_item_ids": {
      "type": "array",
      "items": {
        "type": "string"
      },
      "uniqueItems": true
    },
    "evidence_refs": {
      "type": "array",
      "items": {
        "type": "string"
      },
      "uniqueItems": true
    },
    "privacy_note": {
      "type": "string"
    },
    "stable_source_id": {
      "type": [
        "string",
        "null"
      ],
      "description": "Stable source ID used with source_revision for deduplication when available."
    },
    "content_digest": {
      "oneOf": [
        {
          "type": "null"
        },
        {
          "type": "object",
          "additionalProperties": false,
          "required": [
            "algorithm",
            "value"
          ],
          "properties": {
            "algorithm": {
              "const": "sha256"
            },
            "value": {
              "type": "string",
              "pattern": "^[a-f0-9]{64}$"
            }
          }
        }
      ],
      "description": "Optional exact-content deduplication fallback; this digest does not establish trust."
    }
  }
}
